{
  "schema_version": "1.0.0",
  "provider": "pravmir-editorial-events",
  "trust_layer": "editorial",
  "events": [
    {
      "source_id": "demo-editorial-service-001",
      "title": "[ДЕМО] Всенощное бдение",
      "summary": "Синтетическая редакционная запись для проверки M5.4. Не является реальным расписанием.",
      "event_type": "service",
      "temporal": {
        "all_day": false,
        "starts_at": "2026-10-10T17:00:00+03:00",
        "ends_at": "2026-10-10T19:00:00+03:00",
        "timezone": "Europe/Moscow",
        "recurrence": {"kind": "none", "rrule": null}
      },
      "status": "draft",
      "venue": {"name": "Демонстрационный храм", "address": null, "place_ref": null},
      "organizer": {"name": "Редакция ПМ — demo fixture", "organisation_ref": null},
      "registration": null,
      "scope": {"jurisdiction": null, "tradition": "orthodox", "locale": "ru-RU"},
      "freshness": {"observed_at": "2026-10-03", "verified_at": null, "expires_at": null},
      "references": [],
      "source_url": null,
      "evidence_note": "Synthetic M5.4 development seed. Must never be treated as a real-world event until replaced by verified source evidence.",
      "aliases": ["demo-service-001"]
    },
    {
      "source_id": "demo-editorial-lecture-001",
      "title": "[ДЕМО] Лекция по истории Церкви",
      "summary": "Синтетическая запись для проверки типов, дат и review queue.",
      "event_type": "lecture",
      "temporal": {
        "all_day": false,
        "starts_at": "2026-10-12T19:00:00+03:00",
        "ends_at": "2026-10-12T20:30:00+03:00",
        "timezone": "Europe/Moscow",
        "recurrence": {"kind": "none", "rrule": null}
      },
      "status": "draft",
      "venue": {"name": "Демонстрационный приходской зал", "address": null, "place_ref": null},
      "organizer": {"name": "Редакция ПМ — demo fixture", "organisation_ref": null},
      "registration": {"required": false, "url": null, "email": null, "phone": null},
      "scope": {"jurisdiction": null, "tradition": "orthodox", "locale": "ru-RU"},
      "freshness": {"observed_at": "2026-10-03", "verified_at": null, "expires_at": null},
      "references": [],
      "source_url": null,
      "evidence_note": "Synthetic M5.4 development seed. Not canonical factual data.",
      "aliases": []
    },
    {
      "source_id": "demo-editorial-pilgrimage-001",
      "title": "[ДЕМО] Паломническая поездка выходного дня",
      "summary": "Синтетическая многодневная запись для проверки temporal overlap.",
      "event_type": "pilgrimage_trip",
      "temporal": {
        "all_day": true,
        "starts_at": "2026-10-17",
        "ends_at": "2026-10-18",
        "timezone": null,
        "recurrence": {"kind": "none", "rrule": null}
      },
      "status": "draft",
      "venue": null,
      "organizer": {"name": "Редакция ПМ — demo fixture", "organisation_ref": null},
      "registration": null,
      "scope": {"jurisdiction": null, "tradition": "orthodox", "locale": "ru-RU"},
      "freshness": {"observed_at": "2026-10-03", "verified_at": null, "expires_at": null},
      "references": [],
      "source_url": null,
      "evidence_note": "Synthetic M5.4 development seed. Not a real pilgrimage announcement.",
      "aliases": []
    }
  ]
}
